,organisation,topic_type,module,topic,lang,channel,link,title,desc,duration,likes,comments,chan_metrics
375,Python,advanced,File Handling,Reading/Writing Files,english,Automation Step by Step,https://www.youtube.com/watch?v=9t3vMi95z2w,Learn JSON Step-by-Step from Scratch,website - https://automationstepbystep.com/ We will learn: What is JSON What is it used for How to create a JSON Demo JSON ...,0,Likes not available,Comments not available,na
376,Python,advanced,File Handling,CSV/JSON Handling,english,TechGeekyArti,https://www.youtube.com/watch?v=X5hqPorm_lw,What is a CSV file and What is it used for?,"This tutorial defines CSV file, its uses and how to convert EXCEL file into CSV file. How to export or save a .csv file from Excel ...",0,Likes not available,Comments not available,na
377,Python,advanced,File Handling,CSV/JSON Handling,english,Namma Veetu Cooku,https://www.youtube.com/watch?v=oejwg0IJWro,JSON to CSV using python in English,JSON to CSV using python in English.,0,Likes not available,Comments not available,na
378,Python,advanced,File Handling,CSV/JSON Handling,english,plus2net,https://www.youtube.com/watch?v=8myaNdeRKwk,Python Pandas reading JSON format data from URL files and dataframes using read_json() with options,We can read data from Json formatted output from URL or from file and generate a dataframe in pandas. We will use read_json() ...,0,Likes not available,Comments not available,na
379,Python,advanced,File Handling,CSV/JSON Handling,english,Automation Step by Step,https://www.youtube.com/watch?v=kK-_gL7Vsc0,What is JSON Schema,website - https://automationstepbystep.com/ What is JSON Schema How to create JSON Schema from JSON Demo To validate ...,0,Likes not available,Comments not available,na
380,Python,advanced,File Handling,CSV/JSON Handling,english,Talking about Computer Science,https://www.youtube.com/watch?v=KUTURT9NIok,JSON conversion: Built-in functions to convert a string in JSON format to a python object,English subtitles are available! You can enable that using video controls. The subtitle has been careful reviewed to provide you a ...,0,Likes not available,Comments not available,na
381,Python,advanced,File Handling,CSV/JSON Handling,english,Python 360,https://www.youtube.com/watch?v=CRBOUgyHb3M,How to Convert PDF to CSV Excel | Python code,Convert PDF invoice to CSV (Excel) using Python code and 'tabula' - full code and conversion demonstration. Tabula is a Python ...,0,Likes not available,Comments not available,na
382,Python,advanced,File Handling,CSV/JSON Handling,english,Microsoft Developer,https://www.youtube.com/watch?v=3FcCrD7yxfQ,Demo: Loading CSV files into DataFrames | Even More Python for Beginners - Data Tools [14 of 31],See how to load data into a DataFrame. Watch the Python for Beginner series here: https://aka.ms/PythonBeginnerSeries For the ...,0,Likes not available,Comments not available,na
383,Python,advanced,File Handling,CSV/JSON Handling,english,Mr Fugu Data Science,https://www.youtube.com/watch?v=M7DSN1yZ4MQ,USING PYTHON JSON MODULE | PARSE JSON | USE API DATA,This video is split into 2 parts: the first you will see the basic uses of json module Python. Then you will connect ...,0,Likes not available,Comments not available,na
384,Python,advanced,File Handling,CSV/JSON Handling,english,Coding Is Fun,https://www.youtube.com/watch?v=WlQ7t0fC5Gs,Python: Copy Data From Multiple Files to Master File | Read/Write Closed Excel Files Using Openpyxl,"This tutorial will show you how to read & write closed Excel Files in Python using openpyxl. In particular, we will copy data from ...",0,Likes not available,Comments not available,na
385,Python,advanced,File Handling,CSV/JSON Handling,english,Socratica,https://www.youtube.com/watch?v=LosIGgon_KM,Urllib - GET Requests || Python Tutorial || Learn Python Programming,Stay in the loop INFINITELY: https://snu.socratica.com/python Python makes it easy to interact with web ...,0,Likes not available,Comments not available,na
386,Python,advanced,File Handling,CSV/JSON Handling,english,Dr Codie,https://www.youtube.com/watch?v=T1M4eCGKEJs,python read input files in simple English,"Python read input files in simple English is a python tutorial that opens files, reads files and writes to files. Learn python code with ...",0,Likes not available,Comments not available,na
387,Python,advanced,File Handling,CSV/JSON Handling,english,MEENA SYAMKUMAR,https://www.youtube.com/watch?v=KWFFcTFc0Ng,[CS 220 / CS319 Spring 2021] LEC 20 Video 2: JSON introduction,,0,Likes not available,Comments not available,na
388,Python,advanced,File Handling,CSV/JSON Handling,english,Chuck Severance,https://www.youtube.com/watch?v=J5DjteDzgoM,PY4E - Web Services - JSON (Chapter 13 Part 4),"http://www.py4e.com - Python for Everybody: Exploring Data Please visit the web site to access a free textbook, free supporting ...",0,Likes not available,Comments not available,na
389,Python,advanced,File Handling,CSV/JSON Handling,english,Senaid Bacinovic,https://www.youtube.com/watch?v=Yb_p6VqSpTg,Learn JSON in 10 Minutes [Tutorial For Beginners],"In this simple and easy-to-understand tutorial for beginners, we will talk about JSON and learn what JSON is, and what we use ...",0,Likes not available,Comments not available,na
390,Python,advanced,File Handling,CSV/JSON Handling,english,Coding Is Fun,https://www.youtube.com/watch?v=svcv8uub0D0,How to Create an Excel Data Entry Form in 10 Minutes Using Python (No VBA) | Easy &amp; Simple,Did you know you can use Python code to create an Excel Data Entry Form? This is a tutorial that will show you how to create one ...,0,Likes not available,Comments not available,na
391,Python,advanced,File Handling,CSV/JSON Handling,english,Chuck Severance,https://www.youtube.com/watch?v=vjQZscHOaG4,Worked Example: GeoJSON API (Chapter 13),"http://www.py4e.com - Python for Everybody: Exploring Data in Python 3.0 Please visit the web site to access a free textbook, free ...",0,Likes not available,Comments not available,na
392,Python,advanced,File Handling,CSV/JSON Handling,english,CodeWithSundeep,https://www.youtube.com/watch?v=BQfK1QKCHys,How to read csv data in html table using Javascript ( JS ) | csv to html,Code : https://codewithsundeep.com/2022/04/read-csv-in-html.html How to read csv data in html table using Javascript ( JS ) | csv ...,0,Likes not available,Comments not available,na
393,Python,advanced,File Handling,CSV/JSON Handling,english,The AI University,https://www.youtube.com/watch?v=3G3bQKzX6to,How to Extract Data using API | What is an API and How exactly it works | Python Code Part 1,"This video titled ""How to Extract Data using API | What is an API and How exactly it works | Python Code Part 1"" explains How to ...",0,Likes not available,Comments not available,na
394,Python,advanced,File Handling,CSV/JSON Handling,english,Corey Schafer,https://www.youtube.com/watch?v=sugvnHA7ElY,Python Tutorial: if __name__ == &#39;__main__&#39;,"In this video, we will take a look at a common conditional statement in Python: if __name__ == '__main__': This conditional is ...",0,Likes not available,Comments not available,na
395,Python,advanced,File Handling,CSV/JSON Handling,english,Coding Is Fun,https://www.youtube.com/watch?v=B6EUzBCTaLw,THIS Python Library Simplifies Working With Pandas,"DOWNLOAD MY EXCEL ADD-IN: https://pythonandvba.com/mytoolbelt Explore the power of Sketch, a new Python library that ...",0,Likes not available,Comments not available,na
396,Python,advanced,File Handling,CSV/JSON Handling,english,AK Python,https://www.youtube.com/watch?v=Q7YGBwKVpds,Machine learning Project : Anomaly detection using Isolation Forest,"Anomaly detection is used to detect the suspicious data in the dataset, one of the unsupervised learning algorithms in machine ...",0,Likes not available,Comments not available,na
397,Python,advanced,File Handling,CSV/JSON Handling,english,Anuj Bhaiya,https://www.youtube.com/watch?v=1OL1asctoZ4,Convert your Google Sheets into REST APIs in 6 Minutes 😱 (and Make Projects),"Register for the GeeksforGeeks Job-A-Thon Hiring challenge for Amazon Alexa: https://bit.ly/3RQwTOL Hey guys, In this video, ...",0,Likes not available,Comments not available,na
398,Python,advanced,File Handling,CSV/JSON Handling,english,MEENA SYAMKUMAR,https://www.youtube.com/watch?v=_A8vVUClp9k,[CS 220 / CS319 Spring 2021] LEC 20 Video 3: sum.py demo,,0,Likes not available,Comments not available,na
399,Python,advanced,File Handling,CSV/JSON Handling,english,Digital Fox,https://www.youtube.com/watch?v=jd6KSMpc9F4,How to encode and decode JSON data using PHP | PHP and JSON Tutorial.,JSON data are everywhere. In this video we are going to learn how to encode and decode php arrays in a json format. You can ...,0,Likes not available,Comments not available,na
400,Python,advanced,File Handling,CSV/JSON Handling,english,Automation Step by Step,https://www.youtube.com/watch?v=I0qLFS_H_bc,Learn XML Syntax From Scratch,website - https://automationstepbystep.com/ XML syntax and rules: Root Must contain a root element that is the parent of all ...,0,Likes not available,Comments not available,na
401,Python,advanced,Modules and Libraries,Importing Modules,english,CodeWithHarry,https://www.youtube.com/watch?v=Pr7UOr35NcI,How import works in Python | Python Tutorial - Day #44,"Python is one of the most demanded programming languages in the job market. Surprisingly, it is equally easy to learn and master ...",0,Likes not available,Comments not available,na
402,Python,advanced,Modules and Libraries,Importing Modules,english,Spoken-Tutorial IIT Bombay,https://www.youtube.com/watch?v=SH39gtv3Yn8,Using python modules - English,Using python modules scipy pylab sys.,0,Likes not available,Comments not available,na
403,Python,advanced,Modules and Libraries,Importing Modules,english,CodeWithHarry,https://www.youtube.com/watch?v=dkVYSsL90Oo,os Module in Python | Python Tutorial - Day #46,"Python is one of the most demanded programming languages in the job market. Surprisingly, it is equally easy to learn and master ...",0,Likes not available,Comments not available,na
404,Python,advanced,Modules and Libraries,Importing Modules,english,CodeWithHarry,https://www.youtube.com/watch?v=xwKO_y2gHxQ,Modules and Pip | Python Tutorial - Day #3,"Python is one of the most demanded programming languages in the job market. Surprisingly, it is equally easy to learn and master ...",0,Likes not available,Comments not available,na
405,Python,advanced,Modules and Libraries,Importing Modules,english,Darkfall,https://www.youtube.com/watch?v=K88a1kXCY5M,Blender Python Tutorial : Importing Modules [learn python for beginners],"In this Blender Python tutorial, we will be taking a look at Importing Modules. We can import specific things from the built-in ...",0,Likes not available,Comments not available,na
406,Python,advanced,Modules and Libraries,Importing Modules,english,WsCube Tech,https://www.youtube.com/watch?v=vhUnkaJAh9A,Top 20 Useful Python Modules &amp; Libraries in 15 Minutes | Learn Python for Beginners,"In this video, learn the Top 20 Useful Python Modules & Libraries in 15 Minutes | Learn Python for Beginners. Scrap Flipkart ...",0,Likes not available,Comments not available,na
407,Python,advanced,Modules and Libraries,Importing Modules,english,CodeWithHarry,https://www.youtube.com/watch?v=oTtIvV-Q1FY,Time Module in Python | Python Tutorial - Day #84,Access the Playlist: https://www.youtube.com/playlist?list=PLu0W_9lII9agwh1XjRt242xIpHhPT2llg Link to the Repl: ...,0,Likes not available,Comments not available,na
408,Python,advanced,Modules and Libraries,Importing Modules,english,CodeWithHarry,https://www.youtube.com/watch?v=Nsb3bLIlO4w,Requests Module in Python | Python Tutorial - Day #89,Access the Playlist: https://www.youtube.com/playlist?list=PLu0W_9lII9agwh1XjRt242xIpHhPT2llg Link to the Repl: ...,0,Likes not available,Comments not available,na
409,Python,advanced,Modules and Libraries,Importing Modules,english,Corey Schafer,https://www.youtube.com/watch?v=sugvnHA7ElY,Python Tutorial: if __name__ == &#39;__main__&#39;,"In this video, we will take a look at a common conditional statement in Python: if __name__ == '__main__': This conditional is ...",0,Likes not available,Comments not available,na
410,Python,advanced,Modules and Libraries,Importing Modules,english,CodeWithHarry,https://www.youtube.com/watch?v=wII2JhNACJE,Shutil Module in Python | Python Tutorial - Day #87,Access the Playlist: https://www.youtube.com/playlist?list=PLu0W_9lII9agwh1XjRt242xIpHhPT2llg Link to the Repl: ...,0,Likes not available,Comments not available,na
411,Python,advanced,Modules and Libraries,Importing Modules,english,CodeBerry Programming School,https://www.youtube.com/watch?v=azq3yDCB3n0,How to import a library in Python – Python tutorial for beginners – CodeBerry Programming School,"In this video, you'll learn how to import a library in Python. Check more Python tutorials for beginners at ...",0,Likes not available,Comments not available,na
412,Python,advanced,Modules and Libraries,Importing Modules,english,Tek Solutions,https://www.youtube.com/watch?v=8nPMYukpHaI,#31 Python MODULES Tutorial for Beginners | Python Tutorial for Beginners #python #teksolutions,Python Tutorial to learn Python programming with examples Learn Python One Video in English: This Python Programming in ...,0,Likes not available,Comments not available,na
413,Python,advanced,Modules and Libraries,Importing Modules,english,WsCube Tech,https://www.youtube.com/watch?v=Xv9Ld2qAjMg,5 Best Python Modules for Beginners 2023 [Full Walkthrough],"In this video, learn 5 Best Python Modules for Beginners 2023 [Full Walkthrough] Build Hangman Game Using Python: ...",0,Likes not available,Comments not available,na
414,Python,advanced,Modules and Libraries,Importing Modules,english,Deep Block,https://www.youtube.com/watch?v=kDSd6LjeEiE,Introduction to Python #12 - Modules,"In Lecture 12, the last of our Introduction to Python Programming course, we will dive into the concept of modules. A module is a ...",0,Likes not available,Comments not available,na
415,Python,advanced,Modules and Libraries,Importing Modules,english,Joseph Delgadillo,https://www.youtube.com/watch?v=jqof_LXVFBg,Learn Python Episode #23: Importing Libraries into a Script,Get The Learn to Code Course Bundle! https://josephdelgadillo.com/product/learn-to-code-course-bundle/ In this tutorial we are ...,0,Likes not available,Comments not available,na
416,Python,advanced,Modules and Libraries,Importing Modules,english,Joseph Delgadillo,https://www.youtube.com/watch?v=cnz09jnw7H8,Importing Libraries | Learn to Code with Python #19,Get The Learn to Code Course Bundle! https://jtdigital.tech/product/learn-to-code-course-bundle/ Enroll directly on Udemy!,0,Likes not available,Comments not available,na
417,Python,advanced,Modules and Libraries,Importing Modules,english,United Top Tech,https://www.youtube.com/watch?v=9dY4ExUEgZw,How to import external python file in HTML using pyscript tutorial,How to import external Python file in HTML using Pyscript is shown.,0,Likes not available,Comments not available,na
418,Python,advanced,Modules and Libraries,Importing Modules,english,Spoken-Tutorial IIT Bombay,https://www.youtube.com/watch?v=qzPArYcEIY8,Using python modules - Telugu,,0,Likes not available,Comments not available,na
419,Python,advanced,Modules and Libraries,Importing Modules,english,pythonmiracle,https://www.youtube.com/watch?v=s8bUKmoGZMA,Module in Python(HINDI)| With SUBTITLES,Hiii friends I help people to learn python in a simple and easy way if you want to learn python then subscribe my YouTube channel ...,0,Likes not available,Comments not available,na
420,Python,advanced,Modules and Libraries,Importing Modules,english,CodeWithHarry,https://www.youtube.com/watch?v=TCWOwavqFrw,Regular Expressions in Python | Python Tutorial - Day #95,Access the Playlist: https://www.youtube.com/playlist?list=PLu0W_9lII9agwh1XjRt242xIpHhPT2llg Link to the Repl: ...,0,Likes not available,Comments not available,na
421,Python,advanced,Modules and Libraries,Importing Modules,english,Socratica,https://www.youtube.com/watch?v=LosIGgon_KM,Urllib - GET Requests || Python Tutorial || Learn Python Programming,Stay in the loop INFINITELY: https://snu.socratica.com/python Python makes it easy to interact with web ...,0,Likes not available,Comments not available,na
422,Python,advanced,Modules and Libraries,Importing Modules,english,CodeWithHarry,https://www.youtube.com/watch?v=y_CX2Rvitk8,if __name__ == &quot;__main__&quot; in Python | Python Tutorial - Day #45,"Python is one of the most demanded programming languages in the job market. Surprisingly, it is equally easy to learn and master ...",0,Likes not available,Comments not available,na
423,Python,advanced,Modules and Libraries,Importing Modules,english,Smartherd,https://www.youtube.com/watch?v=VPAvB5R6d5g,Importing &amp; Exporting Modules | TypeScript Tutorial,"Access 7000+ courses for 60 days FREE: https://pluralsight.pxf.io/c/1291657/424552/7490 ""In this lesson, you will see how you ...",0,Likes not available,Comments not available,na
424,Python,advanced,Modules and Libraries,Importing Modules,english,Numoni,https://www.youtube.com/watch?v=D8ZMMPnWjE8,14  Importing Python Libraries,Learn Python the easy way with this easy to follow course. Don't forget to subscribe and follow us on Facebook ...,0,Likes not available,Comments not available,na
425,Python,advanced,Modules and Libraries,Importing Modules,english,Spoken-Tutorial IIT Bombay,https://www.youtube.com/watch?v=OQLyGncYUAE,Writing python scripts - English,Writing python scripts.,0,Likes not available,Comments not available,na
426,Python,advanced,Modules and Libraries,Standard Libraries,english,WsCube Tech,https://www.youtube.com/watch?v=vhUnkaJAh9A,Top 20 Useful Python Modules &amp; Libraries in 15 Minutes | Learn Python for Beginners,"In this video, learn the Top 20 Useful Python Modules & Libraries in 15 Minutes | Learn Python for Beginners. Scrap Flipkart ...",0,Likes not available,Comments not available,na
427,Python,advanced,Modules and Libraries,Standard Libraries,english,CodeWithHarry,https://www.youtube.com/watch?v=dkVYSsL90Oo,os Module in Python | Python Tutorial - Day #46,"Python is one of the most demanded programming languages in the job market. Surprisingly, it is equally easy to learn and master ...",0,Likes not available,Comments not available,na
428,Python,advanced,Modules and Libraries,Standard Libraries,english,CodeWithHarry,https://www.youtube.com/watch?v=Pr7UOr35NcI,How import works in Python | Python Tutorial - Day #44,"Python is one of the most demanded programming languages in the job market. Surprisingly, it is equally easy to learn and master ...",0,Likes not available,Comments not available,na
429,Python,advanced,Modules and Libraries,Standard Libraries,english,Spoken-Tutorial IIT Bombay,https://www.youtube.com/watch?v=SH39gtv3Yn8,Using python modules - English,Using python modules scipy pylab sys.,0,Likes not available,Comments not available,na
430,Python,advanced,Modules and Libraries,Standard Libraries,english,CodeBerry Programming School,https://www.youtube.com/watch?v=azq3yDCB3n0,How to import a library in Python – Python tutorial for beginners – CodeBerry Programming School,"In this video, you'll learn how to import a library in Python. Check more Python tutorials for beginners at ...",0,Likes not available,Comments not available,na
431,Python,advanced,Modules and Libraries,Standard Libraries,english,CodeWithHarry,https://www.youtube.com/watch?v=oTtIvV-Q1FY,Time Module in Python | Python Tutorial - Day #84,Access the Playlist: https://www.youtube.com/playlist?list=PLu0W_9lII9agwh1XjRt242xIpHhPT2llg Link to the Repl: ...,0,Likes not available,Comments not available,na
432,Python,advanced,Modules and Libraries,Standard Libraries,english,WsCube Tech! ENGLISH,https://www.youtube.com/watch?v=V-j0FTGoblg,Request Library in Python for Web Scraping - Complete Tutorial,"In this video, learn Request Library in Python for Web Scraping - Complete Tutorial. Find all the videos of the WEB SCRAPING ...",0,Likes not available,Comments not available,na
433,Python,advanced,Modules and Libraries,Standard Libraries,english,Coding Is Fun,https://www.youtube.com/watch?v=B6EUzBCTaLw,THIS Python Library Simplifies Working With Pandas,"DOWNLOAD MY EXCEL ADD-IN: https://pythonandvba.com/mytoolbelt Explore the power of Sketch, a new Python library that ...",0,Likes not available,Comments not available,na
434,Python,advanced,Modules and Libraries,Standard Libraries,english,CodeWithHarry,https://www.youtube.com/watch?v=a7baAGCBA9U,Classes and Objects in Python | Python Tutorial - Day #57,Access the Playlist: https://www.youtube.com/playlist?list=PLu0W_9lII9agwh1XjRt242xIpHhPT2llg Link to the Repl: ...,0,Likes not available,Comments not available,na
435,Python,advanced,Modules and Libraries,Standard Libraries,english,codebasics,https://www.youtube.com/watch?v=P1uHDPpe_04,Build language translator with 3 lines of python code,In just 3 lines of python code you can translate a statement from one language to another. I will show you how in this video.,0,Likes not available,Comments not available,na
436,Python,advanced,Modules and Libraries,Standard Libraries,english,tech authority,https://www.youtube.com/watch?v=GTAMWVb3DkE,Python Programming Language Interview Questions and Answers – Part 1 | Python for Beginners Course,Python Programming Language Interview Questions and Answers – Part 1 | Python for Beginners Course | Python Interview ...,0,Likes not available,Comments not available,na
437,Python,advanced,Modules and Libraries,Standard Libraries,english,Bro Code,https://www.youtube.com/watch?v=DB9Cq6TSTuQ,Python user input ⌨️,"Python user input tutorial #python #user #input name = input(""What is your name?: "") age = int(input(""How old are you?: "")) height ...",0,Likes not available,Comments not available,na
438,Python,advanced,Modules and Libraries,Standard Libraries,english,CodeWithHarry,https://www.youtube.com/watch?v=gTj2OWd5YnM,Python vs JavaScript: Which one to Learn in 2023? (For Jobs),Claim Free Student License for Pycharm Pro: https://jb.gg/Free_Student_License Download PyCharm: ...,0,Likes not available,Comments not available,na
439,Python,advanced,Modules and Libraries,Standard Libraries,english,CodeWithHarry,https://www.youtube.com/watch?v=f00Kxt-PFYA,"Choosing the Right Python Web Framework: Django, Flask, or FastAPI?","Are you a Python developer looking to build web applications, but not sure which framework to choose? In this video, we'll explore ...",0,Likes not available,Comments not available,na
440,Python,advanced,Modules and Libraries,Standard Libraries,english,The Comparison Channel,https://www.youtube.com/watch?v=Rldzskbnjgo,ARRAYS in Python - Start Here!,"So, what is an array? Well, it's a data structure that stores a collection of items, typically in a contiguous block of memory.",0,Likes not available,Comments not available,na
441,Python,advanced,Modules and Libraries,Standard Libraries,english,CodeWithHarry,https://www.youtube.com/watch?v=-KsfUaQEY9Y,Inheritance in Python | Python Tutorial - Day #61,Access the Playlist: https://www.youtube.com/playlist?list=PLu0W_9lII9agwh1XjRt242xIpHhPT2llg Link to the Repl: ...,0,Likes not available,Comments not available,na
442,Python,advanced,Modules and Libraries,Standard Libraries,english,CODING BY AVNEET,https://www.youtube.com/watch?v=p6BzUFypEcA,What is Python? | Introduction To Python Language For Beginners,"Python is an interpreted, high-level and general-purpose programming language. Python's design philosophy emphasizes code ...",0,Likes not available,Comments not available,na
443,Python,advanced,Modules and Libraries,Standard Libraries,english,WsCube Tech! ENGLISH,https://www.youtube.com/watch?v=8t5Ibc9Mzq8,Python Program to Find The Square Root (English) | Tutorial for Beginners,"In this video, learn Python Program to Find The Square Root (English) | Tutorial for Beginners. Find all the videos of the PYTHON ...",0,Likes not available,Comments not available,na
444,Python,advanced,Modules and Libraries,Standard Libraries,english,Ben Eater,https://www.youtube.com/watch?v=yOyaJXpAYZQ,Comparing C to machine language,"In this video, I compare a simple C program with the compiled machine code of that program. Support me on Patreon: ...",0,Likes not available,Comments not available,na
445,Python,advanced,Modules and Libraries,Standard Libraries,english,Spoken-Tutorial IIT Bombay,https://www.youtube.com/watch?v=qzPArYcEIY8,Using python modules - Telugu,,0,Likes not available,Comments not available,na
446,Python,advanced,Modules and Libraries,Standard Libraries,english,Fabio Musanni - Programming Channel,https://www.youtube.com/watch?v=jtM9RLAENVE,Unit Converter in Python | Unit Conversion with Python,Support me and get exclusive perks: https://www.patreon.com/FabioMusanni ⬇️ Coursera Professional Certificates (Affiliate ...,0,Likes not available,Comments not available,na
447,Python,advanced,Modules and Libraries,Standard Libraries,english,AllTech,https://www.youtube.com/watch?v=4DrCIVS5U3Y,Image to Text with Python - pytesseract 💥 👍 2022,"Support this channel, become a member: https://www.youtube.com/channel/UCBGENnRMZ3chHn_9gkcrFuA/join Udemy ...",0,Likes not available,Comments not available,na
448,Python,advanced,Modules and Libraries,Standard Libraries,english,iTanny,https://www.youtube.com/watch?v=iZ44MR9o0ao,Python Features &amp; Uses || Python Tutorial #2,"This is the 2nd Tutorial on Python. In this video, we will learn about Python Features and Uses.",0,Likes not available,Comments not available,na
