,organisation,topic_type,module,topic,lang,channel,link,title,desc,duration,likes,comments,chan_metrics
740,Data Science,advanced,Model Evaluation,Cross-Validation,english,Quantra,https://www.youtube.com/watch?v=y4SpIEmQAOo,Decision Tree in Python | Decision Tree for Trading | Machine Learning Algorithms | Quantra,Decision Tree for Trading: https://quantra.quantinsti.com/course/decision-trees-analysis-trading-ernest-chan ** START FOR FREE ...,0,Likes not available,Comments not available,na
741,Data Science,advanced,Model Evaluation,Cross-Validation,english,Gate Smashers,https://www.youtube.com/watch?v=fxXZf4zDjGQ,Verification vs Validation in Software Engineering,Subscribe to our new channel:https://www.youtube.com/@varunainashots Links for SE notes: Link-1: https://rb.gy/f8z86 ...,0,Likes not available,Comments not available,na
742,Data Science,advanced,Model Evaluation,Cross-Validation,english,RANJI RAJ,https://www.youtube.com/watch?v=WxINg-eof2M,Machine Learning | Underfitting &amp; Overfitting,The cause of the poor performance of a model in machine learning is either overfitting or underfitting the data. #MachineLearning ...,0,Likes not available,Comments not available,na
743,Data Science,advanced,Model Evaluation,Cross-Validation,english,KNIMETV,https://www.youtube.com/watch?v=IPocK55TTK4,Data Preprocessing for Machine Learning Models - Part II,"This is the second video of a series of two videos, introducing some of the classic data preparation steps that might be needed ...",0,Likes not available,Comments not available,na
744,Data Science,advanced,Model Evaluation,Cross-Validation,english,Bhavesh Bhatt,https://www.youtube.com/watch?v=XABw4Y3GBR4,"Decision Tree Hyperparameters  : max_depth, min_samples_split, min_samples_leaf, max_features",In this video we will explore the most important hyper-parameters of Decision tree model and how they impact our model in term of ...,0,Likes not available,Comments not available,na
745,Data Science,advanced,Model Evaluation,Cross-Validation,english,codebasics,https://www.youtube.com/watch?v=B01qMFMAgUQ,Machine Learning Tutorial Python - 20: Bias vs Variance In Machine Learning,Bias variance trade off is a popular term in statistics. In this video we will look into what bias and variance means in the field of ...,0,Likes not available,Comments not available,na
746,Data Science,advanced,Model Evaluation,Cross-Validation,english,Underfitted,https://www.youtube.com/watch?v=Q_uf9Ik2S28,Should You Stop Splitting Your Data Like This?,Random splitting your dataset is one of those recommendations that sound great in Machine Learning books and tutorials. But do ...,0,Likes not available,Comments not available,na
747,Data Science,advanced,Model Evaluation,Cross-Validation,english,Gate Smashers,https://www.youtube.com/watch?v=EYeF2e2IKEo,Introduction to Neural Networks with Example in HINDI | Artificial Intelligence,Subscribe to our new channel:https://www.youtube.com/@varunainashots Link for AI notes: https://rb.gy/9kj1z ‍  Contributed ...,0,Likes not available,Comments not available,na
748,Data Science,advanced,Model Evaluation,Cross-Validation,english,RANJI RAJ,https://www.youtube.com/watch?v=Pqo9o0286Qs,Machine Learning | K-Nearest Neighbor (KNN),"KNN (K — Nearest Neighbors) is one of many (supervised learning) algorithms used in data mining and machine learning, it's a ...",0,Likes not available,Comments not available,na
749,Data Science,advanced,Model Evaluation,Cross-Validation,english,Jordan Boyd-Graber,https://www.youtube.com/watch?v=kdaX9p6Uc9k,How you can use Perplexity to see how good a Language Model is [Lecture],"This is a single lecture from a course. If you you like the material and want more context (e.g., the lectures that came before), check ...",0,Likes not available,Comments not available,na
750,Data Science,advanced,Model Evaluation,Cross-Validation,english,Google Cloud Tech,https://www.youtube.com/watch?v=rOOQ-A22TBU,Machine Learning with Scikit-Learn and Xgboost on Google Cloud Platform (Next Rewind &#39;18),"If you're doing Machine Learning in Python, you're probably familiar with open source frameworks like scikit-learn and XGBoost.",0,Likes not available,Comments not available,na
751,Data Science,advanced,Model Evaluation,Metrics,english,Power Couple,https://www.youtube.com/watch?v=AI1eKN1Eldg,FASTEST Way to Learn Data Science and ACTUALLY Get a Job,Becoming a Data Scientist requires mastering many different skills. In this video we will cover: 1. How to become a Data Scientist ...,0,Likes not available,Comments not available,na
752,Data Science,advanced,Model Evaluation,Metrics,english,CareerFoundry,https://www.youtube.com/watch?v=NOJKAzIH8hA,How to tell if a career in Data Analytics is right for you...,"Interested to start your own journey into data analytics? Get started today with CareerFoundry's free data analytics short course, ...",0,Likes not available,Comments not available,na
753,Data Science,advanced,Model Evaluation,Metrics,english,CareerFoundry,https://www.youtube.com/watch?v=lgCNTuLBMK4,A Beginners Guide To The Data Analysis Process,"What is the data analysis process? What steps are involved, and how do they relate to the wider discipline of data analytics?",0,Likes not available,Comments not available,na
754,Data Science,advanced,Model Evaluation,Metrics,english,CareerFoundry,https://www.youtube.com/watch?v=yZvFH7B6gKI,What Is Data Analytics? - An Introduction (Full Guide),"What exactly is data analytics? What would you be doing as a data analyst, and what kind of hard and soft skills do you need to ...",0,Likes not available,Comments not available,na
755,Data Science,advanced,Model Evaluation,Metrics,english,CareerFoundry,https://www.youtube.com/watch?v=T08eJt9DlgU,Data Scientist vs Data Analyst - Which Is Right For You? (2023),"What's the difference between Data Science and Data Analytics? Both roles are in huge demand at the moment, so let's define ...",0,Likes not available,Comments not available,na
756,Data Science,advanced,Model Evaluation,Metrics,english,Learning Champion,https://www.youtube.com/watch?v=Cg0W6mod9Hw,Discrete v/s Continuous Data - What? How? || Discrete Data || Continuous Data,This video will discuss DISCRETE and CONTINUOUS DATA with Examples and Animation. Please subscribe to our channel for ...,0,Likes not available,Comments not available,na
757,Data Science,advanced,Model Evaluation,Metrics,english,HuggingFace,https://www.youtube.com/watch?v=M05L1DhFqcw,What is the BLEU metric?,The BLEU metric is often used to evaluate translation models. This video will explain to you how it works. This video is part of the ...,0,Likes not available,Comments not available,na
758,Data Science,advanced,Model Evaluation,Metrics,english,IBM Technology,https://www.youtube.com/watch?v=GE3JOFwTWVM,What is Time Series Analysis?,"Learn more about a data fabric architecture → https://ibm.biz/data-fabric-architecture What is a ""time series"" to begin with, and ...",0,Likes not available,Comments not available,na
759,Data Science,advanced,Model Evaluation,Metrics,english,CareerFoundry,https://www.youtube.com/watch?v=f3FnCoKWmBg,How I&#39;d Learn Data Analytics in 2023 (If I Had to Start Over),"Looking to get started in Data Analytics in 2023? This is the video for you! In it, we share what you need to know and the steps you ...",0,Likes not available,Comments not available,na
760,Data Science,advanced,Model Evaluation,Metrics,english,TED-Ed,https://www.youtube.com/watch?v=7bUVjJWA6Vw,Why the metric system matters - Matt Anticole,"View full lesson: http://ed.ted.com/lessons/why-the-metric-system-matters-matt-anticole For the majority of recorded human history, ...",0,Likes not available,Comments not available,na
761,Data Science,advanced,Model Evaluation,Metrics,english,codebasics,https://www.youtube.com/watch?v=yCDevFTNbC0,"What is Standard Deviation and Mean Absolute Deviation | Math, Statistics for data science, ML",Standard deviation and mean absolute deviation are used in statistics to measure how far apart individual data points are from the ...,0,Likes not available,Comments not available,na
762,Data Science,advanced,Model Evaluation,Metrics,english,Stefanovic,https://www.youtube.com/watch?v=AYWLZ1lES6g,FASTEST Way to Become a Data Analyst and ACTUALLY Get a Job,"Today, I'll share how to learn Data Analysis fast and how to get your first full-time Data Analyst job - step by step. As a self taught ...",0,Likes not available,Comments not available,na
763,Data Science,advanced,Model Evaluation,Metrics,english,intricity101,https://www.youtube.com/watch?v=4qFZ-5i4GS8,What is a Data Model?,Why is a Data Model so important? What is a packaged Data Model? How does a Data Model fit into a Data Warehousing project?,0,Likes not available,Comments not available,na
764,Data Science,advanced,Model Evaluation,Metrics,english,Khan Academy,https://www.youtube.com/watch?v=4PCktDZJH8E,Linear transformations | Matrix transformations | Linear Algebra | Khan Academy,Introduction to linear transformations Watch the next lesson: ...,0,Likes not available,Comments not available,na
765,Data Science,advanced,Model Evaluation,Metrics,english,Kevin Stratvert,https://www.youtube.com/watch?v=b-cFv2DvEqE,Excel AI - data analysis made easy,"In this step-by-step tutorial, learn how to use Artificial Intelligence or A.I. in Microsoft Excel to easily and to quickly analyze your ...",0,Likes not available,Comments not available,na
766,Data Science,advanced,Model Evaluation,Metrics,english,Everything Science,https://www.youtube.com/watch?v=DF4GDAqweo8,How Big Data Controls Stock Markets,How Big Data Controls Stock Markets: Big data and technology govern the markets like never before. Between stalactite data and ...,0,Likes not available,Comments not available,na
767,Data Science,advanced,Model Evaluation,Metrics,english,CoinGecko,https://www.youtube.com/watch?v=tvW9VKJ58Lg,A Guide to On-Chain Analysis and How It Works,On-chain metrics turn blockchain-based transaction data into actionable crypto market insights. Think of it as a tool to give ...,0,Likes not available,Comments not available,na
768,Data Science,advanced,Model Evaluation,Metrics,english,Delaware ShoutOut - Social Media Strategies,https://www.youtube.com/watch?v=Cw22bCgrdLU,Analytics Made Simple: Your TOP 5 Social Media Metrics!,"Too many metrics, too little time! In this video, my goal is to simplify your analytics. I'll show you the most important metrics to ...",0,Likes not available,Comments not available,na
769,Data Science,advanced,Model Evaluation,Metrics,english,Great Learning,https://www.youtube.com/watch?v=Ao4-ZIPOGJI,Sentiment Analysis In 10 Minutes | Sentiment Analysis Using Python | Great Learning,1000+ Free Courses With Free Certificates: ...,0,Likes not available,Comments not available,na
770,Data Science,advanced,Model Evaluation,Metrics,english,Crash Chemistry Academy,https://www.youtube.com/watch?v=TY4Yoyur3X4,"metric unit conversions shortcut: fast, easy how-to with examples","Quick and easy metric prefix conversions shortcut, which simply relies on the difference between the exponents represented by ...",0,Likes not available,Comments not available,na
771,Data Science,advanced,Model Evaluation,Metrics,english,CareerFoundry,https://www.youtube.com/watch?v=jgXp1EE4Wms,Data Analytics - The 9 Essential Tools! (2023),Looking to get started in Data Analytics? Here's a rapid-fire list of the essential tools (and languages) you'll need to pick-up and ...,0,Likes not available,Comments not available,na
772,Data Science,advanced,Model Evaluation,Metrics,english,IBM Technology,https://www.youtube.com/watch?v=uPsUjKLHLAg,Data Governance Explained in 5 Minutes,"Learn about a platform to help direct, manage and monitor AI activities → https://ibm.biz/BdPu9s Data Governance and Privacy ...",0,Likes not available,Comments not available,na
773,Data Science,advanced,Model Evaluation,Metrics,english,Excel Campus - Jon,https://www.youtube.com/watch?v=9NUjHBNWe9M,"Introduction to Pivot Tables, Charts, and Dashboards in Excel (Part 1)","Sign up for our Excel webinar, times added weekly: https://www.excelcampus.com/blueprint-registration/ WATCH PART 2: ...",0,Likes not available,Comments not available,na
774,Data Science,advanced,Model Evaluation,Metrics,english,3Blue1Brown,https://www.youtube.com/watch?v=kYB8IZa5AuE,"Linear transformations and matrices | Chapter 3, Essence of linear algebra",Quite possibly the most important idea for understanding linear algebra. Help fund future projects: ...,0,Likes not available,Comments not available,na
775,Data Science,advanced,Model Evaluation,Metrics,english,mathantics,https://www.youtube.com/watch?v=ZNX-a-5jGeM,Math Antics - Intro to the Metric System,Learn More at mathantics.com Visit http://www.mathantics.com for more Free math videos and additional subscription based ...,0,Likes not available,Comments not available,na
776,C++,basic,Basics,Variables,english,Neso Academy,https://www.youtube.com/watch?v=imNlJohlLPk,Writing a Simple C++ Program,C++ Programming: Writing a Simple C++ Program Topics discussed: 1. Basic introduction to the 'main' function. 2. Elements of a ...,0,Likes not available,Comments not available,na
777,C++,basic,Basics,Variables,english,LearningLad,https://www.youtube.com/watch?v=z600MQdQ9lg,"C++ Constants, Variables, Data types, Keywords | C++ Programming Video Tutorial","In this c++ / cpp programming video tutorials / lecture for beginners video series, you will learn the concepts of constants, variables ...",0,Likes not available,Comments not available,na
778,C++,basic,Basics,Variables,english,Neso Academy,https://www.youtube.com/watch?v=1Wrc91mp980,Input and Output in C++,C++ Programming: Input and Output in C++ Topics discussed: 1. Input/Output in C++. 2. The iostream Library: • istream • ostream ...,0,Likes not available,Comments not available,na
779,C++,basic,Basics,Variables,english,Neso Academy,https://www.youtube.com/watch?v=s0g4ty29Xgg,Introduction to C++ Programming,C++ Programming: Introduction Topics discussed: 1. Basic introduction to C++. 2. C++: An extension of C. 3. Prerequisites. 4.,0,Likes not available,Comments not available,na
780,C++,basic,Basics,Variables,english,Transcode,https://www.youtube.com/watch?v=ghCbURMWBD8,Coding Basics: Variables | Programming for Beginners |,Welcome to Transcode! We want to create videos that help break down Computer Science topics for beginners or anyone who ...,0,Likes not available,Comments not available,na
781,C++,basic,Basics,Variables,english,The Developers House,https://www.youtube.com/watch?v=fZ6HHeJcgxY,How to declare and initialize a variable in C++ || With english subtitles.,,0,Likes not available,Comments not available,na
782,C++,basic,Basics,Variables,english,Atish Jain,https://www.youtube.com/watch?v=Ax8_9S9ql34,"17. Variables, Datatypes and Modifiers in CPP|  C++ Programming Course in Telugu","In this video, we'll cover the essential variables, data types and modifiers that you need to know in Telugu language . We'll cover ...",0,Likes not available,Comments not available,na
783,C++,basic,Basics,Variables,english,Atish Jain,https://www.youtube.com/watch?v=kv0UX85jAh0,30. Reference Variable in C++ | Beginner&#39;s Guide to Learning C++ | C++  in Telugu,"In this video, we'll explore what reference variables are, how they work, and when you might want to use them instead of pointers ...",0,Likes not available,Comments not available,na
784,C++,basic,Basics,Variables,english,Neso Academy,https://www.youtube.com/watch?v=b3G9RjG4l2s,Declaring &amp; Initializing Pointers in C,C Programming: Declaring & Initializing Pointers in C Topics discussed: 1) Declaration of the pointer variable. 2) Initialization of ...,0,Likes not available,Comments not available,na
785,C++,basic,Basics,Variables,english,Atish Jain,https://www.youtube.com/watch?v=uwf28GZ7rpU,19. Variable Declarations | Beginner&#39;s Guide to Learning C++ | C++  in Telugu,"In this video, we'll cover the basics of variable declaration in C++. We'll start by discussing the syntax of variable declaration, ...",0,Likes not available,Comments not available,na
786,C++,basic,Basics,Variables,english,The Cherno,https://www.youtube.com/watch?v=f3FVU-iwNuA,Static in C++,Twitter ▻ https://twitter.com/thecherno Instagram ▻ https://instagram.com/thecherno Patreon ▻ https://patreon.com/thecherno ...,0,Likes not available,Comments not available,na
787,C++,basic,Basics,Variables,english,The Cherno,https://www.youtube.com/watch?v=X8nYM8wdNRE,Inheritance in C++,Twitter ▻ https://twitter.com/thecherno Instagram ▻ https://instagram.com/thecherno Patreon ▻ https://patreon.com/thecherno ...,0,Likes not available,Comments not available,na
788,C++,basic,Basics,Variables,english,Neso Academy,https://www.youtube.com/watch?v=udfbq4M2Kfc,Basics of Dynamic Memory Allocation,Data Structures: Basics of Dynamic Memory Allocation Topics discussed: 1) What is Static Memory Allocation? 2) Example of ...,0,Likes not available,Comments not available,na
789,C++,basic,Basics,Variables,english,AmanBytes,https://www.youtube.com/watch?v=RSDzvlXmQi4,Learn C++ in 10 Minutes !! C++ Tutorial for Beginners,Master the basics of C++ programming in just 10 minutes! Timestamps: 00:00 History of C++ 00:39 Basic C++ Program 01:19 ...,0,Likes not available,Comments not available,na
790,C++,basic,Basics,Variables,english,IT Education Network,https://www.youtube.com/watch?v=x-tj7tEfNoI,C++ Video Tutorial - Lecture 04 - Types of Variables,"C++, Video Learning C++, Video Learning, c++ lectures for beginners, E Learning in English.",0,Likes not available,Comments not available,na
791,C++,basic,Basics,Variables,english,LinkedIn Learning,https://www.youtube.com/watch?v=m7rrk65GiXY,C++ Tutorial - LINKED LISTS,Learn how to create linked lists in C++ and store a set of elements that can grow and shrink dynamically. For more tips to advance ...,0,Likes not available,Comments not available,na
792,C++,basic,Basics,Variables,english,GeeksforGeeks,https://www.youtube.com/watch?v=3rDp0yOACZQ,C++ Programming Language Tutorial | Strings in C++ | GeeksforGeeks,Find Complete Code at GeeksforGeeks Article: https://www.geeksforgeeks.org/c-string-class-and-its-applications/ This video is ...,0,Likes not available,Comments not available,na
793,C++,basic,Basics,Variables,english,Neso Academy,https://www.youtube.com/watch?v=xlt_bEqfnxg,Value of Operator in Pointers,C Programming: Value of Operator in Pointers. Topics discussed: 1) Use of value of operator in pointers. 2) Important points ...,0,Likes not available,Comments not available,na
794,C++,basic,Basics,Variables,english,CodeWithHarry,https://www.youtube.com/watch?v=KjZ3IakXzFA,What are Environment Variables | Hacking?,What are environment variables? All the source code and other material will be uploaded on https://codewithharry.com as and ...,0,Likes not available,Comments not available,na
795,C++,basic,Basics,Variables,english,Mary Elaine Califf,https://www.youtube.com/watch?v=2Q07Xl8XlEM,Arrays in C++,"An introduction to statically allocated arrays in C++ for Java programmers, emphasizing the differences between C++ and Java.",0,Likes not available,Comments not available,na
796,C++,basic,Basics,Variables,english,CodeWithHarry,https://www.youtube.com/watch?v=ORCuz7s5cCY,Variables and Data Types | Python Tutorial - Day #6,"Python is one of the most demanded programming languages in the job market. Surprisingly, it is equally easy to learn and master ...",0,Likes not available,Comments not available,na
797,C++,basic,Basics,Variables,english,Neso Academy,https://www.youtube.com/watch?v=SQCPZYAXoZs,Conditionals and Loops (Solved Problem 1),C Programming & Data Structures: Conditionals and Loops (Solved Problem 1) Topics discussed: 1) Problem on for loop in C ...,0,Likes not available,Comments not available,na
798,C++,basic,Basics,Variables,english,Neso Academy,https://www.youtube.com/watch?v=ij2jrsUmwCI,Understanding the Void Pointers,Data Structures: Understanding the Void Pointers Topics discussed: 1) What is a void pointer? 2) The use of void pointers. 3) Use ...,0,Likes not available,Comments not available,na
799,C++,basic,Basics,Variables,english,LinkedIn Learning,https://www.youtube.com/watch?v=TMtcnfepsuw,C++ Tutorial - Using STRUCTS to store different data types,"Learn the basics of structs, a user-defined data type in C++ that can store a custom set of system data types. Explore more C++ ...",0,Likes not available,Comments not available,na
800,C++,basic,Basics,Variables,english,Neso Academy,https://www.youtube.com/watch?v=obJcPlAtGVM,Loop Control Statements − break and continue,C Programming & Data Structures: break and continue statements in C programming. Topics discussed: 1) Break statement.,0,Likes not available,Comments not available,na
801,C++,basic,Basics,Data Types,english,Neso Academy,https://www.youtube.com/watch?v=ZniDyolzrBw,Data Types vs. Abstract Data Types,Data Structures: Data Types vs. Abstract Data Types in Data Structures Topics discussed: 1) Data types. 2) Difference between ...,0,Likes not available,Comments not available,na
802,C++,basic,Basics,Data Types,english,LinkedIn Learning,https://www.youtube.com/watch?v=TMtcnfepsuw,C++ Tutorial - Using STRUCTS to store different data types,"Learn the basics of structs, a user-defined data type in C++ that can store a custom set of system data types. Explore more C++ ...",0,Likes not available,Comments not available,na
803,C++,basic,Basics,Data Types,english,Neso Academy,https://www.youtube.com/watch?v=T9DSBhBR_I4,Types of Data Structures,Data Structures: Types of Data Structures Topics discussed: 1) Linear and non-linear data structures. 2) Static and dynamic data ...,0,Likes not available,Comments not available,na
804,C++,basic,Basics,Data Types,english,Programming Concepts,https://www.youtube.com/watch?v=Y7-zPX2G4i0,Data Types In C++ - Programming Concepts,"This is the second video of ""C++ For Beginners"" series. We shall learn about data types in this video. Enjoy!",0,Likes not available,Comments not available,na
805,C++,basic,Basics,Data Types,english,Neso Academy,https://www.youtube.com/watch?v=imNlJohlLPk,Writing a Simple C++ Program,C++ Programming: Writing a Simple C++ Program Topics discussed: 1. Basic introduction to the 'main' function. 2. Elements of a ...,0,Likes not available,Comments not available,na
806,C++,basic,Basics,Data Types,english,Neso Academy,https://www.youtube.com/watch?v=1Wrc91mp980,Input and Output in C++,C++ Programming: Input and Output in C++ Topics discussed: 1. Input/Output in C++. 2. The iostream Library: • istream • ostream ...,0,Likes not available,Comments not available,na
807,C++,basic,Basics,Data Types,english,LearningLad,https://www.youtube.com/watch?v=z600MQdQ9lg,"C++ Constants, Variables, Data types, Keywords | C++ Programming Video Tutorial","In this c++ / cpp programming video tutorials / lecture for beginners video series, you will learn the concepts of constants, variables ...",0,Likes not available,Comments not available,na
808,C++,basic,Basics,Data Types,english,Neso Academy,https://www.youtube.com/watch?v=s0g4ty29Xgg,Introduction to C++ Programming,C++ Programming: Introduction Topics discussed: 1. Basic introduction to C++. 2. C++: An extension of C. 3. Prerequisites. 4.,0,Likes not available,Comments not available,na
809,C++,basic,Basics,Data Types,english,thecplusplusguy,https://www.youtube.com/watch?v=kPstXPqb7sI,C++ tutorial 2 - data types,In this video tutorial I'll show you the most importand build-in data types and a simple example.,0,Likes not available,Comments not available,na
810,C++,basic,Basics,Data Types,english,Tom Scott,https://www.youtube.com/watch?v=6otW6OXjR8c,Why TRUE + TRUE = 2: Data Types,"INT, BOOLEAN, STRING and FLOAT: these are the things that data is made of. • Sponsored by Dashlane — for free on your first ...",0,Likes not available,Comments not available,na
811,C++,basic,Basics,Data Types,english,Neso Academy,https://www.youtube.com/watch?v=xLetJpcjHS0,Introduction to Data Structures,Data Structures: The Introduction to Data Structures Topics discussed: 1) What is Data? 2) The difference between Data and ...,0,Likes not available,Comments not available,na
812,C++,basic,Basics,Data Types,english,Atish Jain,https://www.youtube.com/watch?v=Ax8_9S9ql34,"17. Variables, Datatypes and Modifiers in CPP|  C++ Programming Course in Telugu","In this video, we'll cover the essential variables, data types and modifiers that you need to know in Telugu language . We'll cover ...",0,Likes not available,Comments not available,na
813,C++,basic,Basics,Data Types,english,LinkedIn Learning,https://www.youtube.com/watch?v=m7rrk65GiXY,C++ Tutorial - LINKED LISTS,Learn how to create linked lists in C++ and store a set of elements that can grow and shrink dynamically. For more tips to advance ...,0,Likes not available,Comments not available,na
814,C++,basic,Basics,Data Types,english,Neso Academy,https://www.youtube.com/watch?v=R9PTBwOzceo,Introduction to Linked List,Data Structures: Introduction to Linked List Topics discussed: 1) Different ways to maintain a list in memory. 2) Types of Linked List ...,0,Likes not available,Comments not available,na
815,C++,basic,Basics,Data Types,english,Tech Gee,https://www.youtube.com/watch?v=JeW9xCtZIvI,Data Types | CompTIA IT Fundamentals FC0-U61 | 1.2,"In this video you will learn about various data types and their characteristics such as Char, Strings, Numbers & Boolean Logic.",0,Likes not available,Comments not available,na
816,C++,basic,Basics,Data Types,english,The Cherno,https://www.youtube.com/watch?v=fLgTtaqqJp0,CLASSES vs STRUCTS in C++,Twitter ▻ https://twitter.com/thecherno Instagram ▻ https://instagram.com/thecherno Patreon ▻ https://patreon.com/thecherno ...,0,Likes not available,Comments not available,na
